{
  "$comment": "GENERATED by bun nv render — do not edit",
  "$schema": "https://json-schema.org/draft/2020-12/schema",
  "title": "decision",
  "type": "object",
  "properties": {
    "title": {
      "type": "string"
    },
    "status": {
      "enum": [
        "accepted",
        "retired"
      ]
    },
    "scope": {
      "type": "string"
    },
    "dependsOn": {
      "type": "array",
      "items": {
        "type": "string",
        "minLength": 1,
        "x-references": "decision"
      }
    },
    "dependsOnText": {
      "type": "string"
    },
    "validatedBy": {
      "type": "string"
    },
    "summary": {
      "type": "object",
      "properties": {
        "group": {
          "enum": [
            "foundations",
            "security",
            "language",
            "types",
            "syntax",
            "core",
            "tooling",
            "internal"
          ]
        },
        "headline": {
          "type": "string"
        },
        "body": {
          "type": "string"
        },
        "pin": {
          "type": "boolean"
        }
      },
      "required": [
        "group",
        "headline",
        "body"
      ],
      "additionalProperties": false
    }
  },
  "required": [
    "title",
    "status",
    "scope",
    "dependsOn"
  ],
  "additionalProperties": false
}
